{
  "contract": "session-catalog-semantic-v1",
  "initial_state": {
    "profile": "default",
    "current_writer_id": "connector-a",
    "current_writer_fence": 3,
    "active_runtime_generation": "runtime-old",
    "retired_runtime_generations": [],
    "catalog_revision": 2,
    "catalog_sequence": 0,
    "catalog_session_keys": ["durable-root"],
    "stable_session_ids": {}
  },
  "operations": [
    {"op": "map_identity", "authenticated_agent_id": "aaaaaaaa-aaaa-4aaa-8aaa-aaaaaaaaaaaa", "profile": "default", "session_key": "durable-root", "session_id": "88888888-8888-4888-8888-888888888888"},
    {
      "op": "snapshot",
      "writer_id": "connector-a",
      "writer_fence": 3,
      "pages": [{
        "profile": "default",
        "runtime_generation": "runtime-new",
        "snapshot_id": "33333333-3333-4333-8333-333333333333",
        "catalog_revision": 1,
        "page_index": 0,
        "is_last": true,
        "sessions": [{"session_key": "durable-root", "authority_revision": 2}]
      }]
    },
    {"op": "map_identity", "authenticated_agent_id": "aaaaaaaa-aaaa-4aaa-8aaa-aaaaaaaaaaaa", "profile": "default", "session_key": "durable-root", "session_id": "88888888-8888-4888-8888-888888888888"},
    {"op": "map_identity", "authenticated_agent_id": "aaaaaaaa-aaaa-4aaa-8aaa-aaaaaaaaaaaa", "profile": "other", "session_key": "durable-root", "session_id": "99999999-9999-4999-8999-999999999999"},
    {"op": "assert_state", "equals": {"stable_session_ids": {"aaaaaaaa-aaaa-4aaa-8aaa-aaaaaaaaaaaa|default|durable-root": "88888888-8888-4888-8888-888888888888", "aaaaaaaa-aaaa-4aaa-8aaa-aaaaaaaaaaaa|other|durable-root": "99999999-9999-4999-8999-999999999999"}}}
  ],
  "expected_errors": []
}
