{
  "contract": "session-catalog-semantic-v1",
  "initial_state": {
    "profile": "default",
    "current_writer_id": "connector-a",
    "current_writer_fence": 3,
    "active_runtime_generation": "runtime-current",
    "retired_runtime_generations": [],
    "catalog_revision": 6,
    "catalog_sequence": 2,
    "catalog_session_keys": ["old-root"],
    "stable_session_ids": {}
  },
  "operations": [
    {
      "op": "snapshot",
      "writer_id": "connector-a",
      "writer_fence": 3,
      "pages": [
        {
          "profile": "default",
          "runtime_generation": "runtime-current",
          "snapshot_id": "11111111-1111-4111-8111-111111111111",
          "catalog_revision": 7,
          "page_index": 0,
          "is_last": true,
          "sessions": [{"session_key": "current-root", "authority_revision": 4}]
        }
      ]
    },
    {"op": "assert_state", "equals": {"catalog_session_keys": ["current-root"]}}
  ],
  "expected_errors": []
}
